GEO.id,GEO.id2,GEO.display-label,HC01_EST_VC01,HC01_MOE_VC01,HC02_EST_VC01,HC02_MOE_VC01,HC03_EST_VC01,HC03_MOE_VC01,HC04_EST_VC01,HC04_MOE_VC01,HC01_EST_VC02,HC01_MOE_VC02,HC02_EST_VC02,HC02_MOE_VC02,HC03_EST_VC02,HC03_MOE_VC02,HC04_EST_VC02,HC04_MOE_VC02,HC01_EST_VC03,HC01_MOE_VC03,HC02_EST_VC03,HC02_MOE_VC03,HC03_EST_VC03,HC03_MOE_VC03,HC04_EST_VC03,HC04_MOE_VC03,HC01_EST_VC04,HC01_MOE_VC04,HC02_EST_VC04,HC02_MOE_VC04,HC03_EST_VC04,HC03_MOE_VC04,HC04_EST_VC04,HC04_MOE_VC04,HC01_EST_VC05,HC01_MOE_VC05,HC02_EST_VC05,HC02_MOE_VC05,HC03_EST_VC05,HC03_MOE_VC05,HC04_EST_VC05,HC04_MOE_VC05,HC01_EST_VC06,HC01_MOE_VC06,HC02_EST_VC06,HC02_MOE_VC06,HC03_EST_VC06,HC03_MOE_VC06,HC04_EST_VC06,HC04_MOE_VC06,HC01_EST_VC07,HC01_MOE_VC07,HC02_EST_VC07,HC02_MOE_VC07,HC03_EST_VC07,HC03_MOE_VC07,HC04_EST_VC07,HC04_MOE_VC07,HC01_EST_VC08,HC01_MOE_VC08,HC02_EST_VC08,HC02_MOE_VC08,HC03_EST_VC08,HC03_MOE_VC08,HC04_EST_VC08,HC04_MOE_VC08,HC01_EST_VC09,HC01_MOE_VC09,HC02_EST_VC09,HC02_MOE_VC09,HC03_EST_VC09,HC03_MOE_VC09,HC04_EST_VC09,HC04_MOE_VC09,HC01_EST_VC10,HC01_MOE_VC10,HC02_EST_VC10,HC02_MOE_VC10,HC03_EST_VC10,HC03_MOE_VC10,HC04_EST_VC10,HC04_MOE_VC10,HC01_EST_VC11,HC01_MOE_VC11,HC02_EST_VC11,HC02_MOE_VC11,HC03_EST_VC11,HC03_MOE_VC11,HC04_EST_VC11,HC04_MOE_VC11,HC01_EST_VC13,HC01_MOE_VC13,HC02_EST_VC13,HC02_MOE_VC13,HC03_EST_VC13,HC03_MOE_VC13,HC04_EST_VC13,HC04_MOE_VC13,HC01_EST_VC15,HC01_MOE_VC15,HC02_EST_VC15,HC02_MOE_VC15,HC03_EST_VC15,HC03_MOE_VC15,HC04_EST_VC15,HC04_MOE_VC15,HC01_EST_VC18,HC01_MOE_VC18,HC02_EST_VC18,HC02_MOE_VC18,HC03_EST_VC18,HC03_MOE_VC18,HC04_EST_VC18,HC04_MOE_VC18,HC01_EST_VC19,HC01_MOE_VC19,HC02_EST_VC19,HC02_MOE_VC19,HC03_EST_VC19,HC03_MOE_VC19,HC04_EST_VC19,HC04_MOE_VC19,HC01_EST_VC20,HC01_MOE_VC20,HC02_EST_VC20,HC02_MOE_VC20,HC03_EST_VC20,HC03_MOE_VC20,HC04_EST_VC20,HC04_MOE_VC20
Id,Id2,Geography,Households; Estimate; Total,Households; Margin of Error; Total,Families; Estimate; Total,Families; Margin of Error; Total,Married-couple families; Estimate; Total,Married-couple families; Margin of Error; Total,Nonfamily households; Estimate; Total,Nonfamily households; Margin of Error; Total,"Households; Estimate; Less than $10,000","Households; Margin of Error; Less than $10,000","Families; Estimate; Less than $10,000","Families; Margin of Error; Less than $10,000","Married-couple families; Estimate; Less than $10,000","Married-couple families; Margin of Error; Less than $10,000","Nonfamily households; Estimate; Less than $10,000","Nonfamily households; Margin of Error; Less than $10,000","Households; Estimate; $10,000 to $14,999","Households; Margin of Error; $10,000 to $14,999","Families; Estimate; $10,000 to $14,999","Families; Margin of Error; $10,000 to $14,999","Married-couple families; Estimate; $10,000 to $14,999","Married-couple families; Margin of Error; $10,000 to $14,999","Nonfamily households; Estimate; $10,000 to $14,999","Nonfamily households; Margin of Error; $10,000 to $14,999","Households; Estimate; $15,000 to $24,999","Households; Margin of Error; $15,000 to $24,999","Families; Estimate; $15,000 to $24,999","Families; Margin of Error; $15,000 to $24,999","Married-couple families; Estimate; $15,000 to $24,999","Married-couple families; Margin of Error; $15,000 to $24,999","Nonfamily households; Estimate; $15,000 to $24,999","Nonfamily households; Margin of Error; $15,000 to $24,999","Households; Estimate; $25,000 to $34,999","Households; Margin of Error; $25,000 to $34,999","Families; Estimate; $25,000 to $34,999","Families; Margin of Error; $25,000 to $34,999","Married-couple families; Estimate; $25,000 to $34,999","Married-couple families; Margin of Error; $25,000 to $34,999","Nonfamily households; Estimate; $25,000 to $34,999","Nonfamily households; Margin of Error; $25,000 to $34,999","Households; Estimate; $35,000 to $49,999","Households; Margin of Error; $35,000 to $49,999","Families; Estimate; $35,000 to $49,999","Families; Margin of Error; $35,000 to $49,999","Married-couple families; Estimate; $35,000 to $49,999","Married-couple families; Margin of Error; $35,000 to $49,999","Nonfamily households; Estimate; $35,000 to $49,999","Nonfamily households; Margin of Error; $35,000 to $49,999","Households; Estimate; $50,000 to $74,999","Households; Margin of Error; $50,000 to $74,999","Families; Estimate; $50,000 to $74,999","Families; Margin of Error; $50,000 to $74,999","Married-couple families; Estimate; $50,000 to $74,999","Married-couple families; Margin of Error; $50,000 to $74,999","Nonfamily households; Estimate; $50,000 to $74,999","Nonfamily households; Margin of Error; $50,000 to $74,999","Households; Estimate; $75,000 to $99,999","Households; Margin of Error; $75,000 to $99,999","Families; Estimate; $75,000 to $99,999","Families; Margin of Error; $75,000 to $99,999","Married-couple families; Estimate; $75,000 to $99,999","Married-couple families; Margin of Error; $75,000 to $99,999","Nonfamily households; Estimate; $75,000 to $99,999","Nonfamily households; Margin of Error; $75,000 to $99,999","Households; Estimate; $100,000 to $149,999","Households; Margin of Error; $100,000 to $149,999","Families; Estimate; $100,000 to $149,999","Families; Margin of Error; $100,000 to $149,999","Married-couple families; Estimate; $100,000 to $149,999","Married-couple families; Margin of Error; $100,000 to $149,999","Nonfamily households; Estimate; $100,000 to $149,999","Nonfamily households; Margin of Error; $100,000 to $149,999","Households; Estimate; $150,000 to $199,999","Households; Margin of Error; $150,000 to $199,999","Families; Estimate; $150,000 to $199,999","Families; Margin of Error; $150,000 to $199,999","Married-couple families; Estimate; $150,000 to $199,999","Married-couple families; Margin of Error; $150,000 to $199,999","Nonfamily households; Estimate; $150,000 to $199,999","Nonfamily households; Margin of Error; $150,000 to $199,999","Households; Estimate; $200,000 or more","Households; Margin of Error; $200,000 or more","Families; Estimate; $200,000 or more","Families; Margin of Error; $200,000 or more","Married-couple families; Estimate; $200,000 or more","Married-couple families; Margin of Error; $200,000 or more","Nonfamily households; Estimate; $200,000 or more","Nonfamily households; Margin of Error; $200,000 or more",Households; Estimate; Median income (dollars),Households; Margin of Error; Median income (dollars),Families; Estimate; Median income (dollars),Families; Margin of Error; Median income (dollars),Married-couple families; Estimate; Median income (dollars),Married-couple families; Margin of Error; Median income (dollars),Nonfamily households; Estimate; Median income (dollars),Nonfamily households; Margin of Error; Median income (dollars),Households; Estimate; Mean income (dollars),Households; Margin of Error; Mean income (dollars),Families; Estimate; Mean income (dollars),Families; Margin of Error; Mean income (dollars),Married-couple families; Estimate; Mean income (dollars),Married-couple families; Margin of Error; Mean income (dollars),Nonfamily households; Estimate; Mean income (dollars),Nonfamily households; Margin of Error; Mean income (dollars),Households; Estimate; PERCENT IMPUTED - Household income in the past 12 months,Households; Margin of Error; PERCENT IMPUTED - Household income in the past 12 months,Families; Estimate; PERCENT IMPUTED - Household income in the past 12 months,Families; Margin of Error; PERCENT IMPUTED - Household income in the past 12 months,Married-couple families; Estimate; PERCENT IMPUTED - Household income in the past 12 months,Married-couple families; Margin of Error; PERCENT IMPUTED - Household income in the past 12 months,Nonfamily households; Estimate; PERCENT IMPUTED - Household income in the past 12 months,Nonfamily households; Margin of Error; PERCENT IMPUTED - Household income in the past 12 months,Households; Estimate; PERCENT IMPUTED - Family income in the past 12 months,Households; Margin of Error; PERCENT IMPUTED - Family income in the past 12 months,Families; Estimate; PERCENT IMPUTED - Family income in the past 12 months,Families; Margin of Error; PERCENT IMPUTED - Family income in the past 12 months,Married-couple families; Estimate; PERCENT IMPUTED - Family income in the past 12 months,Married-couple families; Margin of Error; PERCENT IMPUTED - Family income in the past 12 months,Nonfamily households; Estimate; PERCENT IMPUTED - Family income in the past 12 months,Nonfamily households; Margin of Error; PERCENT IMPUTED - Family income in the past 12 months,Households; Estimate; PERCENT IMPUTED - Nonfamily income in the past 12 months,Households; Margin of Error; PERCENT IMPUTED - Nonfamily income in the past 12 months,Families; Estimate; PERCENT IMPUTED - Nonfamily income in the past 12 months,Families; Margin of Error; PERCENT IMPUTED - Nonfamily income in the past 12 months,Married-couple families; Estimate; PERCENT IMPUTED - Nonfamily income in the past 12 months,Married-couple families; Margin of Error; PERCENT IMPUTED - Nonfamily income in the past 12 months,Nonfamily households; Estimate; PERCENT IMPUTED - Nonfamily income in the past 12 months,Nonfamily households; Margin of Error; PERCENT IMPUTED - Nonfamily income in the past 12 months
0600000US4200100116,4200100116,"Abbottstown borough, Adams County, Pennsylvania",332,50,246,45,183,36,86,28,1.5,1.7,0,9.7,0,12.7,5.8,6.7,3.6,2.4,0.8,1.2,0,12.7,11.6,8.5,8.1,3.6,7.7,5.4,6.6,5.2,16.3,10.1,11.7,5.4,9.3,5.9,6.6,5.6,12.8,10.4,15.1,5.3,19.5,7.8,11.5,7.1,10.5,8.6,38,8.2,37.8,7.6,43.2,8.7,33.7,17.8,12.7,4.3,13.4,5,16.9,6.3,5.8,6.8,7.2,3.4,8.5,4.5,11.5,6.2,3.5,4.7,1.5,1.5,2,2,2.7,2.7,0,24.8,0.6,1,0.8,1.3,1.1,1.7,0,24.8,57115,6402,60500,8149,66250,2930,45000,26857,59240,4156,63406,4877,N,N,42641,8376,22.6,(X),(X),(X),(X),(X),(X),(X),(X),(X),27.2,(X),(X),(X),(X),(X),(X),(X),(X),(X),(X),(X),9.3,(X)
0600000US4200102928,4200102928,"Arendtsville borough, Adams County, Pennsylvania",346,77,252,64,160,46,94,39,2,3.3,1.2,1.7,0,14.4,7.4,12.1,4.6,4.3,2,3.5,0,14.4,11.7,13.8,13.3,7.7,16.3,9.4,11.3,9.6,14.9,16,17.1,9,13.1,10.6,7.5,9.8,14.9,15.5,14.5,8.8,13.5,10.4,16.3,14.3,17,17.5,21.1,9.5,24.2,11.3,23.1,10.8,22.3,19.6,10.1,7.2,10.3,8.3,11.3,10.2,9.6,15.1,13.3,7.4,13.9,8,21.9,12,2.1,4.1,1.7,2,2.4,2.7,3.8,4.2,0,23.1,2.3,2.9,3.2,4,5,5.9,0,23.1,46364,16244,53750,15184,69318,10197,36250,21688,69695,21096,77266,27429,N,N,42034,11595,25.4,(X),(X),(X),(X),(X),(X),(X),(X),(X),30.2,(X),(X),(X),(X),(X),(X),(X),(X),(X),(X),(X),12.8,(X)
0600000US4200105536,4200105536,"Bendersville borough, Adams County, Pennsylvania",255,60,197,55,146,46,58,25,0,9.3,3.6,4.4,0,15.7,0,33.4,3.1,4,0,11.9,0,15.7,8.6,15.4,6.7,6.1,3,4.9,4.1,6.4,19,19.7,24.3,11.8,17.3,12.1,10.3,10,48.3,23.6,16.1,11.1,14.2,13.7,17.1,17.8,15.5,13.6,16.1,9.6,18.8,12.2,10.3,8.5,8.6,11.7,24.3,10.8,31.5,14.1,42.5,18,0,33.4,8.6,7.9,10.7,10.3,14.4,13.9,0,33.4,0.8,1.3,1,1.6,1.4,2.2,0,33.4,0,9.3,0,11.9,0,15.7,0,33.4,49948,18219,60156,17147,79750,17573,26711,2281,60020,8548,67834,10698,N,N,29928,7135,27.8,(X),(X),(X),(X),(X),(X),(X),(X),(X),28.9,(X),(X),(X),(X),(X),(X),(X),(X),(X),(X),(X),17.2,(X)
0600000US4200105880,4200105880,"Berwick township, Adams County, Pennsylvania",864,62,660,69,556,70,204,44,5,3.3,3.9,3.9,1.6,1.8,8.3,5.7,2.8,1.6,2.6,1.8,0.9,1.2,5.9,4.9,8.7,3.9,3.8,3.3,1.3,1.3,22.1,10.1,11.9,3.2,8.8,3.7,10.4,4.4,22.1,8.8,12.3,4.2,11.7,4.9,10.8,5,17.2,11.5,20.7,5.5,23.3,6.9,24.6,7.9,9.3,7,15.4,5.1,17.9,6.3,18,6.5,7.4,6,13.1,4.7,15.9,6.1,18,7.2,3.9,2.9,6.1,2.6,6.8,3.1,8.1,3.7,3.9,4.9,4.1,3.1,5.3,4.1,6.3,4.8,0,11.5,63229,4091,70921,7799,78056,12186,28958,6845,75508,8397,85126,9984,N,N,43616,8198,22.3,(X),(X),(X),(X),(X),(X),(X),(X),(X),21.8,(X),(X),(X),(X),(X),(X),(X),(X),(X),(X),(X),24,(X)
0600000US4200106296,4200106296,"Biglerville borough, Adams County, Pennsylvania",444,51,265,44,192,39,179,48,2.9,2.2,1.1,1.7,1.6,2.3,5.6,5,8.8,5.6,6.8,7.3,0,12.2,13.4,9.7,5,3.2,8.7,6.5,8.3,8.4,6.1,5.5,16.4,7.8,15.8,8.8,6.8,5.3,20.7,13.1,23.6,8.3,12.5,5.7,13,7,33.5,15.1,18.7,6.9,18.5,7.4,22.9,9.2,15.1,10.2,10.1,4.5,15.8,6.9,20.3,8.6,2.2,3.2,9,3.4,12.8,5.3,16.1,6.9,1.7,2.7,3.4,3.3,5.7,5.3,7.8,7.4,0,13,2,1.9,2.3,2.6,3.1,3.5,1.7,2.8,42100,8668,56250,16652,73611,8946,36042,3658,65238,14111,77171,21234,N,N,43492,12904,23.2,(X),(X),(X),(X),(X),(X),(X),(X),(X),26.8,(X),(X),(X),(X),(X),(X),(X),(X),(X),(X),(X),11.7,(X)
0600000US4200107560,4200107560,"Bonneauville borough, Adams County, Pennsylvania",687,72,550,71,334,56,137,43,10.9,7,12.2,8.6,3.9,4.1,5.8,6.3,1.9,1.9,0.9,1.8,0,7.2,5.8,5.9,7.7,3.5,6.2,4.4,1.2,1.9,21.9,13.7,15,6,15.1,7,4.5,3.4,19.7,10.8,13.7,4.8,12.2,5.3,11.4,6.2,29.2,13.9,22.4,6,19.1,5.8,26.3,8,17.5,12.2,9.5,3.3,12.4,4.1,16.5,6,0,16.6,15.6,5.2,17.8,6.7,29.3,9.7,0,16.6,1.3,1.2,1.6,1.5,2.7,2.4,0,16.6,2,2.6,2.5,3.2,4.2,5.1,0,16.6,51058,7060,54000,13400,77500,15848,33393,6605,63873,9424,68378,12081,N,N,34542,5312,17.6,(X),(X),(X),(X),(X),(X),(X),(X),(X),14.5,(X),(X),(X),(X),(X),(X),(X),(X),(X),(X),(X),21.9,(X)
0600000US4200110456,4200110456,"Butler township, Adams County, Pennsylvania",1024,70,786,47,664,56,238,74,2.9,1.7,3.2,2,2.4,2,3.8,4.3,5.8,2.2,1.3,1.4,0.9,1.3,20.6,8.8,4.9,2.4,4.1,2.2,3.3,2.3,10.1,7,11.4,4.4,10.8,4.5,7.7,4.7,13,11.9,18.2,5.5,15.6,5.6,14.3,5.3,26.5,13.1,20.5,4.3,21.2,5.6,22.9,6,16,8.8,15.5,4.5,16.7,5.4,18.2,6.1,10.1,9.1,16.1,4.8,21,6.1,23,6.8,0,10,1.4,1.1,1.8,1.5,2.1,1.7,0,10,3.3,2,4.3,2.6,5.1,3,0,10,57115,7796,66905,8780,72917,12878,36500,8621,71043,7066,80441,8725,N,N,37987,5250,26.2,(X),(X),(X),(X),(X),(X),(X),(X),(X),29.4,(X),(X),(X),(X),(X),(X),(X),(X),(X),(X),(X),11.3,(X)
0600000US4200111472,4200111472,"Carroll Valley borough, Adams County, Pennsylvania",1342,82,1041,66,961,74,301,80,0,1.8,0,2.4,0,2.6,0,8,2.7,2.8,0,2.4,0,2.6,12,12.3,0,1.8,0,2.4,0,2.6,0,8,2.2,2.2,1.2,1.6,1.2,1.7,5.6,8.2,13.9,6.4,11.5,6.5,11.2,6.7,22.3,14.7,26.9,7.7,29.9,8.2,27.9,8,21.6,14.2,14.8,5.8,14.4,6.2,13,6.3,16.3,13.8,26.8,7.5,29.6,8.6,32,9.4,15.9,11.2,9.4,3.6,9.1,4.4,9.9,4.7,6.3,8.8,3.4,2.9,4.3,3.8,4.7,4.1,0,8,78936,7810,82431,22215,95398,28223,54779,9977,95961,7964,102486,9070,N,N,68204,15253,24.1,(X),(X),(X),(X),(X),(X),(X),(X),(X),27.7,(X),(X),(X),(X),(X),(X),(X),(X),(X),(X),(X),12,(X)
0600000US4200115632,4200115632,"Conewago township, Adams County, Pennsylvania",2796,134,2111,123,1813,140,685,128,2.3,1.8,0.3,0.4,0,1.4,9.2,7.2,1.8,1.3,0.9,0.8,0.3,0.5,5.3,5,11.6,4,9.4,4.7,8,5,21.9,9.1,8.3,2.7,6.6,3,4.4,2.3,14.2,7.2,17.6,4.1,13.4,4.1,12.5,4.3,26.1,10.1,20.4,4,22.7,4.7,22.6,5.1,12.6,6.3,16.2,3.8,19.9,4.9,21.5,5.7,4.5,5,14.3,2.9,17.3,4.1,19.9,4.6,4.7,3,5.2,2.7,6.2,3.6,7.2,4.1,1.6,2.2,2.4,1.8,3.2,2.3,3.8,2.7,0,3.6,62206,3506,72483,4039,76841,4998,34735,4861,71034,4164,80307,5611,N,N,39733,5057,18.3,(X),(X),(X),(X),(X),(X),(X),(X),(X),21.6,(X),(X),(X),(X),(X),(X),(X),(X),(X),(X),(X),7.3,(X)
0600000US4200117640,4200117640,"Cumberland township, Adams County, Pennsylvania",2458,115,1758,78,1415,102,700,109,2.8,1.5,2.9,2,0.7,0.8,5.1,3.3,7.3,2.4,3.6,2.8,4.2,3.4,15.9,5.9,8.3,2.4,4.8,2.3,2,2.3,18.4,5.8,8.9,3.6,8.2,4.1,6,3.6,10.1,6.5,11.6,2.7,10.6,3.3,9.7,3.6,14.7,5.2,17,3.2,17.2,4.5,18.4,5.1,17.9,6.4,16.8,3.7,19.2,4.2,19.4,5,8.7,4.7,15.7,3.4,18.9,4.4,22.1,5.4,4.4,3.3,4.8,1.9,7.3,2.8,9.1,3.5,0.6,1,6.8,2.2,7,3,8.3,3.7,4.1,3.6,69485,7410,77292,4310,86908,7695,35938,11089,85210,7537,96897,9781,N,N,50935,8803,21.4,(X),(X),(X),(X),(X),(X),(X),(X),(X),22.1,(X),(X),(X),(X),(X),(X),(X),(X),(X),(X),(X),18,(X)
0600000US4200120792,4200120792,"East Berlin borough, Adams County, Pennsylvania",569,69,411,59,314,52,158,36,4.2,2,1.2,1.5,0.6,0.9,12,6.4,7,3.8,2.7,3.3,2.9,4.2,18.4,10.3,12.1,4.5,10.2,5.3,4.8,5.2,17.1,7.8,10.9,4.1,9.2,4.5,9.2,5.5,15.2,7.1,14.8,4.8,15.1,5.9,12.1,5.6,19,10.1,20,5.5,22.4,7.3,21.7,7.3,13.9,9.1,18.1,5.6,22.9,7,28,9.7,4.4,4.1,12.3,5,15.6,6.5,19.7,8.2,0,14.6,0.5,0.8,0.7,1.1,1,1.4,0,14.6,0,4.3,0,5.9,0,7.6,0,14.6,53958,13889,66797,5717,72143,10225,27679,8331,56921,4427,65590,5236,N,N,30947,4546,21.1,(X),(X),(X),(X),(X),(X),(X),(X),(X),20.7,(X),(X),(X),(X),(X),(X),(X),(X),(X),(X),(X),20.9,(X)
0600000US4200124560,4200124560,"Fairfield borough, Adams County, Pennsylvania",243,45,164,38,136,33,79,29,4.1,3.2,3.7,4,2.2,3.4,7.6,6.7,2.5,4.3,0,14.1,0,16.7,7.6,12.9,10.3,4.9,4.9,4.1,5.1,4.6,22.8,13.1,16.5,8.8,14,10.6,16.9,12.2,21.5,14.7,9.9,6,12.2,8.5,14.7,10.1,2.5,4.7,30,10.9,31.7,11.6,26.5,12.1,25.3,16.9,14.8,6.1,18.3,8.2,16.9,7.7,7.6,8.2,7,4.5,8.5,7,9.6,7.9,5.1,5.7,4.9,5.7,6.7,8.1,8.1,9.9,0,26.6,0,9.8,0,14.1,0,16.7,0,26.6,53375,3229,55833,13956,57500,18870,28281,13606,59203,9032,67697,11830,N,N,39671,9687,39.9,(X),(X),(X),(X),(X),(X),(X),(X),(X),37.8,(X),(X),(X),(X),(X),(X),(X),(X),(X),(X),(X),44.3,(X)
0600000US4200127320,4200127320,"Franklin township, Adams County, Pennsylvania",1869,201,1258,153,927,174,611,182,5.2,3.5,3.1,3.4,1.3,2.1,13.9,10.3,4.3,4.3,0,2,0,2.7,13.1,12.9,8.7,5.4,6.1,6,1.2,1.8,13.9,9,13.3,6.9,8.3,5.5,7.2,5.4,27.2,17.1,12.8,5.3,8.7,5.6,8.5,6,21.3,13,17.7,7.1,23.9,9.1,23.5,9.3,3.3,5.2,12.1,5,13.8,6.3,16.6,7.7,5.1,5.5,16.4,5.8,21.8,8.4,23.6,9.3,2.3,3.6,6.1,3.5,9.1,5.2,12.3,6.9,0,4,3.5,2.8,5.2,4.3,5.7,5.3,0,4,61022,7426,74967,10404,81131,11781,32639,9024,76068,9712,93853,13545,N,N,32556,6647,24.1,(X),(X),(X),(X),(X),(X),(X),(X),(X),23.7,(X),(X),(X),(X),(X),(X),(X),(X),(X),(X),(X),25,(X)
0600000US4200127704,4200127704,"Freedom township, Adams County, Pennsylvania",349,44,279,39,265,39,70,24,2.9,3.9,6.1,6.8,3,4.9,2.9,6.2,5.4,4.9,0,8.6,0,9,14.3,12.4,4.3,2.8,2.5,2.7,1.5,2,11.4,10.7,4.6,3,4.7,3.6,4.9,3.8,4.3,6,12.3,4.9,12.2,5.3,12.1,5.2,15.7,12.1,19.8,6.2,16.1,5.7,17,6,31.4,16.3,14.9,5.5,17.6,6.7,18.5,7,4.3,6.5,19.5,5.8,22.2,6.5,23.4,6.7,8.6,7.1,6.9,3,8.6,3.6,9.1,3.7,0,29.2,9.5,4.4,10,5.2,10.6,5.4,7.1,6.9,75568,9622,83393,10761,86250,10870,50357,9467,111866,23237,124275,28174,N,N,60204,14859,30.7,(X),(X),(X),(X),(X),(X),(X),(X),(X),30.8,(X),(X),(X),(X),(X),(X),(X),(X),(X),(X),(X),30,(X)
0600000US4200128936,4200128936,"Germany township, Adams County, Pennsylvania",966,46,816,44,742,55,150,54,0,2.6,0,3,0,3.3,0,15.3,3.9,3.4,2.2,1.6,0.8,1.1,21.3,19.9,6.3,2.9,3.8,2.5,2.3,2.2,19.3,13.7,9,3.8,6.7,4.3,3.8,2.3,25.3,20,10.9,4.1,11.6,4.5,11.5,4.9,4,5.5,21,5.6,19.1,5.8,21,6.4,22.7,14.8,17.8,5.4,20.1,6.2,22.1,6.6,5.3,6.7,21.8,5,25.9,6.1,27,6.5,0,15.3,4.7,2.6,5.5,3,6.1,3.3,0,15.3,4.6,2.6,5,3,5.5,3.3,2,3.2,74236,7844,85435,8097,87898,5037,28056,3228,83463,6487,90633,8134,N,N,39221,10685,24.3,(X),(X),(X),(X),(X),(X),(X),(X),(X),21,(X),(X),(X),(X),(X),(X),(X),(X),(X),(X),(X),37.3,(X)
0600000US4200128960,4200128960,"Gettysburg borough, Adams County, Pennsylvania",2235,239,1132,137,638,134,1103,204,9.4,3.4,8.7,5.9,0,3.8,12.6,4.9,9.8,3.6,6.4,4.4,2,2.6,14,5.7,21.4,6,16.5,7.7,13.6,9.8,25,8.8,13.1,4.4,13.3,6.4,9.1,6.4,12.9,6.2,10,3.2,12.6,5.7,17.2,9.2,7.6,3.2,17.2,4.5,18,6.3,20.7,8.5,14.1,6.4,5.8,2.3,6.6,3.8,8.8,5.4,4.9,2.6,10,3.2,12.3,4.9,21,8.1,7.6,4.5,2.6,1.4,4.8,2.6,6.1,4.3,0.4,0.8,0.9,0.9,0.8,0.9,1.4,1.6,0.9,1.4,31158,6508,40045,5764,61731,11256,22366,6267,48427,5148,57425,8176,N,N,37652,5252,22.8,(X),(X),(X),(X),(X),(X),(X),(X),(X),21.7,(X),(X),(X),(X),(X),(X),(X),(X),(X),(X),(X),23.8,(X)
0600000US4200132144,4200132144,"Hamilton township, Adams County, Pennsylvania",897,62,750,52,634,63,147,38,1.3,1.2,0.9,1.1,1.1,1.3,3.4,4.8,4,2.7,0.5,0.9,0,3.9,21.8,14.4,9.7,4.2,6.5,3.8,4.7,3.5,25.9,16.7,5.4,2.9,4.1,2.6,3.8,2.4,14.3,11.1,12.3,3.8,11.9,4.5,10.7,3.9,23.8,14.6,17.7,4.9,21.9,6,24,6.8,0,15.6,26.2,5.9,29.2,7.8,26.2,7.2,10.9,12.9,11.7,4,14,4.8,16.6,5.5,0,15.6,8.1,4.4,6.7,2.9,7.9,3.4,0,15.6,3.6,1.8,4.3,2.2,5,2.6,0,15.6,74375,8706,79750,6837,82188,9922,24659,15948,85404,9251,91381,9038,N,N,30182,7761,20.3,(X),(X),(X),(X),(X),(X),(X),(X),(X),18.5,(X),(X),(X),(X),(X),(X),(X),(X),(X),(X),(X),25.9,(X)
0600000US4200132200,4200132200,"Hamiltonban township, Adams County, Pennsylvania",911,60,649,71,527,67,262,59,1.5,1.3,0.6,0.9,0,4.6,3.8,3.9,8.5,4.5,2.2,1.9,0.8,1.2,26,13.2,6.9,3.1,2.6,2.3,0.8,1.1,18.7,9.4,13.8,4.4,15.4,5.4,14.8,6.1,11.5,7.4,9,3.9,13.4,5.5,11.4,5.9,0,9.1,25.2,6,26.7,6.8,29.2,7.8,17.9,10.8,16.1,3.9,17.7,5.1,19.4,6.1,9.5,6.5,15.6,4.9,16.8,4.8,18,5.7,12.6,10.3,2.9,1.8,4,2.5,4.9,3.1,0,9.1,0.4,0.7,0.6,0.9,0.8,1.1,0,9.1,57156,4343,62841,10449,70781,9158,25714,12927,63061,4979,69835,5335,N,N,43669,10197,27.8,(X),(X),(X),(X),(X),(X),(X),(X),(X),23.3,(X),(X),(X),(X),(X),(X),(X),(X),(X),(X),(X),37.4,(X)
0600000US4200134424,4200134424,"Highland township, Adams County, Pennsylvania",365,41,290,33,251,33,75,26,2.5,3.9,3.1,5,0,9.5,0,27.7,0,6.6,0,8.3,0,9.5,0,27.7,7.1,3.2,4.8,2.7,4,2.9,21.3,12.3,6.6,3.7,5.5,3.8,5.2,4,12,10.6,13.2,5.6,12.4,5,10.4,4.8,18.7,17.2,24.7,7.1,23.4,8.6,26.3,9.6,20,13.4,13.7,4.8,14.5,5.7,15.1,6.2,10.7,9.4,23,5.2,26.6,6.1,27.9,6.5,9.3,9.4,4.9,3,6.2,3.9,7.2,4.7,0,27.7,4.4,2.6,3.4,2.5,4,2.8,8,8.1,69792,10948,77500,14786,81250,8320,49531,14182,83684,8446,86577,9049,N,N,69475,18928,29,(X),(X),(X),(X),(X),(X),(X),(X),(X),29.7,(X),(X),(X),(X),(X),(X),(X),(X),(X),(X),(X),21.3,(X)
0600000US4200136424,4200136424,"Huntington township, Adams County, Pennsylvania",932,80,683,86,574,79,249,61,1.2,1.2,0,3.6,0,4.3,4.4,4.7,7.3,4,4.5,3.2,2.6,2.9,14.9,9.9,10.6,3.2,5.1,2.8,6.1,3.3,25.7,10.5,8.8,3,4.5,2.8,3.3,2.7,20.5,7.5,14.1,4.5,14.5,5.4,13.1,5.4,12.9,8.9,17.6,6,18.7,7,18.6,7.6,16.9,11,21.2,5.6,30.3,7.1,30.8,6.8,2.8,4.2,16.3,4.8,18.3,5.9,21.8,6.7,2,3.8,1.9,1.4,2.6,1.9,2.1,1.7,0,9.5,1,1.1,1.3,1.4,1.6,1.7,0,9.5,55174,4810,77782,15279,79597,6181,26488,5083,65013,5299,75134,5615,N,N,33312,6598,22.7,(X),(X),(X),(X),(X),(X),(X),(X),(X),21.4,(X),(X),(X),(X),(X),(X),(X),(X),(X),(X),(X),24.5,(X)
0600000US4200141672,4200141672,"Latimore township, Adams County, Pennsylvania",952,67,779,53,699,52,173,63,2.1,1.8,1.3,1.8,1.4,2,5.8,5.9,1.8,1.9,0.6,1,0,3.5,9.8,9.5,5.5,2.7,4,2.5,2.9,2.3,12.1,10.1,7.6,4.1,3.7,2.8,2.7,2.6,24.9,14.8,6.2,2.5,5.3,2.7,5,2.7,11,8.9,24.2,5.6,23.4,5.9,23.7,6,31.2,17.6,20.2,5.8,22.6,6.8,22.5,7.2,2.3,3.2,21.8,6.4,26.1,7.6,29,8.2,2.9,4.5,6.7,4.6,8.2,5.5,7.3,6,0,13.4,4,2,4.9,2.5,5.4,2.8,0,13.4,79048,9378,90096,9627,94010,6793,34375,18341,93559,11975,104341,13769,N,N,40571,6753,28.2,(X),(X),(X),(X),(X),(X),(X),(X),(X),26.3,(X),(X),(X),(X),(X),(X),(X),(X),(X),(X),(X),32.9,(X)
0600000US4200143056,4200143056,"Liberty township, Adams County, Pennsylvania",508,57,387,52,353,48,121,33,2,1.9,0,6.3,0,6.8,8.3,8.1,1.8,1.9,0,6.3,0,6.8,7.4,7.6,4.7,3.1,2.6,2.4,2,2.2,11.6,10,9.4,3.8,9.6,4.3,8.8,4.3,11.6,8.3,17.7,5.8,13.4,4.9,13.9,5.4,31.4,15.6,23.4,6.3,27.6,7.8,24.6,6.9,19,15.5,13,5.3,12.4,4.8,13.6,5.4,3.3,4.4,13,4.9,15.5,6,16.4,6.3,5,6.1,7.9,4.2,10.3,5.4,11.3,5.8,0,18.6,7.1,3.2,8.5,3.7,9.3,4.1,2.5,4,59881,5041,69583,12459,76250,15938,40938,8058,88190,9706,98390,10595,N,N,49264,14919,28.5,(X),(X),(X),(X),(X),(X),(X),(X),(X),31.3,(X),(X),(X),(X),(X),(X),(X),(X),(X),(X),(X),16.5,(X)
0600000US4200143944,4200143944,"Littlestown borough, Adams County, Pennsylvania",1800,109,1217,81,997,76,583,132,2.8,1.6,4,3.8,0,2.5,7.2,4.5,4.1,2.4,1.4,1.5,0.8,1.2,8.2,5.8,7.8,3.5,4.4,3.1,1.9,2.1,15.1,7.9,11.1,4.4,6.7,4,4.9,3.1,20.2,10.3,14.4,4,13.1,4.9,9.3,4,20.1,8.5,28,5.2,30.4,7.1,35.2,7.7,17.7,8.4,17.2,5,20,5.7,23.4,6.9,8.6,8.5,10.6,3.7,15,5,18.3,6.1,2.9,3.2,2.9,2,3.6,2.7,4.4,3.4,0,4.2,1,1.2,1.5,1.8,1.8,2.2,0,4.2,57829,3536,65515,5352,72039,7478,34732,4791,64079,4400,73667,5559,N,N,38993,5391,20.7,(X),(X),(X),(X),(X),(X),(X),(X),(X),22.4,(X),(X),(X),(X),(X),(X),(X),(X),(X),(X),(X),14.1,(X)
0600000US4200146376,4200146376,"McSherrystown borough, Adams County, Pennsylvania",1231,106,721,87,461,100,510,136,6.6,4,1.7,2.4,0,5.3,13.5,9.5,4.7,5.3,3.6,3.6,4.1,6.3,7.6,11.6,16.3,6.4,4.9,4.7,4.3,5.3,32.5,14.2,19.7,7.8,20.2,8.1,5.2,5.4,21.8,14.2,12.2,5.8,14.7,8.8,16.9,11.5,4.3,4.6,19.1,7.3,24.8,11,25.4,11.2,11,9.5,9.3,5,13.6,7.6,21.3,11.2,3.3,5.1,9.9,5.4,12.8,8.2,16.9,12,5.9,6.4,1.3,2.2,2.2,3.6,3.5,5.6,0,4.8,0.9,1.5,1.5,2.6,2.4,4,0,4.8,36102,5409,55027,7838,64350,17571,21875,10155,49679,6450,62369,8745,N,N,30759,7649,27.5,(X),(X),(X),(X),(X),(X),(X),(X),(X),25.2,(X),(X),(X),(X),(X),(X),(X),(X),(X),(X),(X),30.6,(X)
0600000US4200148608,4200148608,"Menallen township, Adams County, Pennsylvania",1287,108,970,92,800,92,317,112,3.5,4.2,0,2.5,0,3.1,14.2,16.3,1.6,2,2.7,3.1,1.6,2.9,2.2,3.7,7.5,4.1,7.2,5,4.4,4.1,10.4,10,11.6,5.4,9.5,4.8,8.1,5,18,16.4,10.5,6.2,13.9,7.9,12.1,6.4,0,7.6,26.9,7.1,21.2,6.6,25,7.8,39.7,18.5,20.7,6.8,23.2,7.1,24.4,9.4,15.5,12.1,11.7,4.5,14.1,5.6,14.5,6,0,7.6,2.4,2.1,3.2,2.8,3.9,3.4,0,7.6,3.7,2.4,4.9,3.1,6,3.8,0,7.6,63984,9785,67300,14409,74038,9457,51031,30175,74361,9223,81860,11473,N,N,46991,10104,27.3,(X),(X),(X),(X),(X),(X),(X),(X),(X),29.1,(X),(X),(X),(X),(X),(X),(X),(X),(X),(X),(X),21.8,(X)
0600000US4200151640,4200151640,"Mount Joy township, Adams County, Pennsylvania",1516,71,1061,88,942,95,455,106,0.9,1,1.3,1.5,1.5,1.7,0,5.3,4.2,2.6,0,2.3,0,2.6,14.1,8.7,7.5,3.7,2.6,2.8,1.9,2.1,18.7,9.8,6.7,4.3,4.1,3.1,2.1,1.9,14.9,11.4,11.5,4.7,8.6,5.4,8.7,6,15.8,9.1,26.3,5.9,28.5,6.8,28.1,6.9,23.7,13.3,9.6,3.7,11,4.5,11.9,5.1,6.4,5.6,19.9,4.4,25.5,6.1,26.2,6.4,4,4.5,6.1,3.5,8.8,4.9,8.8,5.2,0,5.3,7.4,3.1,9.5,4.1,10.7,4.6,2.4,4.2,68529,5817,85417,11783,88241,12363,37969,14147,91977,11845,105052,10897,N,N,59550,28636,24.4,(X),(X),(X),(X),(X),(X),(X),(X),(X),25.2,(X),(X),(X),(X),(X),(X),(X),(X),(X),(X),(X),20.4,(X)
0600000US4200151776,4200151776,"Mount Pleasant township, Adams County, Pennsylvania",1772,124,1296,105,1155,124,476,143,1.1,1.6,0,1.9,0,2.1,4,6,0.9,1.4,0,1.9,0,2.1,3.4,5.1,15.6,5.9,11.5,5.2,7.3,4.9,26.7,14.4,10.9,4.7,7.9,4.7,8.1,4.9,19.1,11.6,13.1,5.2,11.4,6,11.8,6.6,17.6,11.3,22.6,6.1,22.3,6.9,21.6,6.8,23.3,11.7,13.4,5.6,18.4,7.5,20.6,8.3,0,5.1,14.8,6.5,20.4,8.6,21.5,9.3,3.2,4.9,6.4,4,6.6,5,7.4,5.5,2.7,3.9,1.1,1.6,1.5,2.2,1.7,2.4,0,5.1,61329,5113,68636,15951,80118,21624,33790,5125,72051,9729,81173,11384,N,N,43226,8805,19.5,(X),(X),(X),(X),(X),(X),(X),(X),(X),21.1,(X),(X),(X),(X),(X),(X),(X),(X),(X),(X),(X),4.4,(X)
